{
  "id": "courtyard-reading",
  "questionCount": 5,
  "durationSeconds": 300,
  "referenceFormat": {
    "year": 2026,
    "questionCount": 20,
    "durationSeconds": 1200,
    "source": "https://snpmb.id/fr/"
  },
  "passages": [
    {
      "id": "courtyard",
      "title": "A courtyard worth reading in",
      "text": "At Meranti High School, an unused corner of the courtyard became an outdoor reading area. Students placed benches beneath two existing trees and filled a waterproof box with donated books. They wanted to learn whether a more welcoming space would encourage reading during lunch breaks. Before the change, a student team counted an average of eight readers in the courtyard each lunchtime for one week. During a week after the change, the average rose to nineteen.\n\nThe increase was encouraging, but the team was cautious. The second week was cooler than the first, and teachers had announced a reading challenge at the same time. Either factor might have influenced students’ choices. The team therefore refused to attribute the entire increase to the new reading area. Instead, they planned to count readers over several more weeks and ask students why they chose to read outside.\n\nThe project also revealed a practical issue. Although the trees provided shade, rain sometimes reached the benches. Students suggested a small roof, but the school postponed that expense until it had stronger evidence that the area would remain useful. For now, volunteers bring the books indoors when heavy rain is expected.\n\nThe experience suggests that small changes can make school spaces more inviting. It also shows why an appealing result should lead to further questions rather than an immediate claim of success. A useful experiment does not simply produce a larger number; it helps people decide what to investigate next.",
      "original": true
    }
  ],
  "questions": [
    {
      "id": "r1",
      "prompt": "Which statement best expresses the passage’s main idea?",
      "choices": [
        "Rain was the only reason students avoided reading outdoors.",
        "Schools should replace all indoor libraries with courtyard benches.",
        "A school reading-space project produced promising results that need careful investigation.",
        "A reading challenge always improves students’ examination scores."
      ],
      "answer": 2,
      "explanation": "Teks menjelaskan kenaikan jumlah pembaca yang menjanjikan, menimbang penyebab lain dan keterbatasan praktis, lalu menyimpulkan bahwa diperlukan pengamatan tambahan.",
      "passageId": "courtyard",
      "evidence": "It also shows why an appealing result should lead to further questions rather than an immediate claim of success.",
      "skill": "Main Idea",
      "translationId": {
        "prompt": "Pernyataan manakah yang paling tepat menggambarkan gagasan utama bacaan?",
        "choices": [
          "Hujan adalah satu-satunya alasan siswa menghindari membaca di luar.",
          "Sekolah seharusnya mengganti semua perpustakaan dalam ruangan dengan bangku halaman.",
          "Proyek ruang baca sekolah menunjukkan hasil menjanjikan, tetapi memerlukan penyelidikan cermat.",
          "Tantangan membaca selalu meningkatkan nilai ujian siswa."
        ]
      }
    },
    {
      "id": "r2",
      "prompt": "Why did the team not attribute all the increase to the new reading area?",
      "choices": [
        "The donated books were missing during the second week.",
        "The school had already removed the benches.",
        "They had not counted any readers before the change.",
        "Cooler weather and a simultaneous reading challenge could also have influenced reading."
      ],
      "answer": 3,
      "explanation": "Paragraf kedua menyebut dua perubahan lain, yaitu cuaca lebih sejuk dan tantangan membaca. Keduanya mungkin ikut memengaruhi hasil sehingga sebab tunggal belum terbukti.",
      "passageId": "courtyard",
      "evidence": "The second week was cooler than the first, and teachers had announced a reading challenge at the same time.",
      "skill": "Supporting Details",
      "translationId": {
        "prompt": "Mengapa tim tidak menganggap seluruh peningkatan disebabkan oleh area baca baru?",
        "choices": [
          "Buku sumbangan hilang pada minggu kedua.",
          "Sekolah sudah memindahkan bangkunya.",
          "Mereka belum menghitung pembaca sebelum perubahan.",
          "Cuaca yang lebih sejuk dan tantangan membaca bersamaan mungkin juga memengaruhi kebiasaan membaca."
        ]
      }
    },
    {
      "id": "r3",
      "prompt": "In paragraph 2, “attribute” is closest in meaning to …",
      "choices": [
        "remove from a record",
        "connect as an effect to a cause",
        "divide into equal groups",
        "describe in a fictional story"
      ],
      "answer": 1,
      "explanation": "Tim tidak mau menyatakan bahwa area baru menyebabkan seluruh peningkatan. Attribute di sini berarti mengaitkan suatu hasil dengan penyebabnya.",
      "passageId": "courtyard",
      "evidence": "The team therefore refused to attribute the entire increase to the new reading area.",
      "skill": "Vocabulary in Context",
      "translationId": {
        "prompt": "Pada paragraf 2, kata “attribute” paling dekat artinya dengan …",
        "choices": [
          "menghapus dari catatan",
          "menghubungkan akibat dengan suatu penyebab",
          "membagi menjadi kelompok yang sama",
          "menggambarkan cerita fiksi"
        ]
      }
    },
    {
      "id": "r4",
      "prompt": "What can reasonably be inferred from the decision to postpone building a roof?",
      "choices": [
        "The school wants more evidence before committing additional money.",
        "The school knows that rain never affects courtyard reading.",
        "The school believes reading outdoors is harmful.",
        "The school has decided to close the reading area permanently."
      ],
      "answer": 0,
      "explanation": "Sekolah menunggu bukti lebih kuat bahwa area baca tetap bermanfaat sebelum mengeluarkan biaya tambahan; bukan berarti sekolah menentang kegiatan membaca.",
      "passageId": "courtyard",
      "evidence": "the school postponed that expense until it had stronger evidence that the area would remain useful.",
      "skill": "Making Inferences",
      "translationId": {
        "prompt": "Apa simpulan yang masuk akal tentang keputusan sekolah menunda pembangunan atap?",
        "choices": [
          "Sekolah ingin lebih banyak bukti sebelum menambah pengeluaran.",
          "Sekolah tahu hujan tidak pernah memengaruhi kegiatan membaca di halaman.",
          "Sekolah percaya membaca di luar berbahaya.",
          "Sekolah memutuskan menutup area baca secara permanen."
        ]
      }
    },
    {
      "id": "r5",
      "prompt": "In paragraph 4, what does “it” in “it helps people decide” refer to?",
      "choices": [
        "A useful experiment",
        "An immediate claim of success",
        "A school courtyard",
        "A larger number"
      ],
      "answer": 0,
      "explanation": "Frasa yang dirujuk adalah a useful experiment pada klausa sebelumnya, bukan larger number atau courtyard.",
      "passageId": "courtyard",
      "evidence": "A useful experiment does not simply produce a larger number; it helps people decide what to investigate next.",
      "skill": "Reference Questions",
      "translationId": {
        "prompt": "Pada paragraf 4, kata “it” dalam “it helps people decide” merujuk pada …",
        "choices": [
          "Eksperimen yang bermanfaat",
          "Klaim keberhasilan langsung",
          "Halaman sekolah",
          "Angka yang lebih besar"
        ]
      }
    }
  ]
}
