{
  "id": "grammar-foundations",
  "questionCount": 5,
  "durationSeconds": 300,
  "questions": [
    {
      "id": "g1",
      "prompt": "Rina ___ to school by bicycle every weekday.",
      "choices": [
        "go",
        "goes",
        "going",
        "is go"
      ],
      "answer": 1,
      "explanation": "Rina merupakan subjek tunggal orang ketiga. Dalam simple present positif, go berubah menjadi goes."
    },
    {
      "id": "g2",
      "prompt": "Manakah kalimat negatif simple present yang benar?",
      "choices": [
        "He does not likes coffee.",
        "He do not like coffee.",
        "He does not like coffee.",
        "He not likes coffee."
      ],
      "answer": 2,
      "explanation": "Setelah does not, gunakan verb dasar like. Does sudah menunjukkan kesesuaian dengan subjek orang ketiga tunggal."
    },
    {
      "id": "g3",
      "prompt": "The books on the shelf ___ useful for our project.",
      "choices": [
        "is",
        "are",
        "was",
        "be"
      ],
      "answer": 1,
      "explanation": "Subjeknya adalah books (jamak), bukan shelf. Jadi bentuk be yang benar adalah are."
    },
    {
      "id": "g4",
      "prompt": "Each of the students ___ a reading journal.",
      "choices": [
        "keep",
        "keeping",
        "keeps",
        "are keeping"
      ],
      "answer": 2,
      "explanation": "Each adalah inti subjek tunggal, sehingga gunakan keeps walaupun students berbentuk jamak dalam frasa of."
    },
    {
      "id": "g5",
      "prompt": "Manakah kalimat tanya yang benar?",
      "choices": [
        "Does Sinta studies English every day?",
        "Do Sinta study English every day?",
        "Does Sinta study English every day?",
        "Sinta does studies English every day?"
      ],
      "answer": 2,
      "explanation": "Subjek Sinta tunggal menggunakan Does + subject + verb dasar study."
    }
  ],
  "passages": []
}
