{
  "id": "quiz-sentence-structure",
  "questionCount": 8,
  "durationSeconds": 600,
  "questions": [
    {
      "id": "q1",
      "prompt": "What is the subject in “My friends enjoy music”?",
      "choices": [
        "music",
        "My friends",
        "enjoy",
        "friends enjoy"
      ],
      "answer": 1,
      "explanation": "My friends adalah subjek yang menikmati musik.",
      "translationId": {
        "prompt": "Manakah subject dalam “My friends enjoy music”?"
      }
    },
    {
      "id": "q2",
      "prompt": "Choose the correct sentence pattern for “Lina eats rice”.",
      "choices": [
        "S–be–Complement",
        "S–O–V",
        "V–S–O",
        "S–V–O"
      ],
      "answer": 3,
      "explanation": "Lina = subject, eats = verb, rice = object.",
      "translationId": {
        "prompt": "Pilih pola yang sesuai untuk “Lina eats rice.”"
      }
    },
    {
      "id": "q3",
      "prompt": "Which sentence is complete?",
      "choices": [
        "Very tired the boy.",
        "The boy is very tired.",
        "The boy very tired.",
        "The is boy tired."
      ],
      "answer": 1,
      "explanation": "Is bertindak sebagai verb penghubung subject dan complement.",
      "translationId": {
        "prompt": "Kalimat manakah yang lengkap?"
      }
    },
    {
      "id": "q4",
      "prompt": "In “She reads at night”, what is the role of “at night”?",
      "choices": [
        "Verb",
        "Subject",
        "Time expression",
        "Object"
      ],
      "answer": 2,
      "explanation": "At night menjelaskan kapan kegiatan membaca dilakukan.",
      "translationId": {
        "prompt": "Dalam “She reads at night”, frasa “at night” adalah …",
        "choices": [
          "Verb",
          "Subject",
          "Keterangan waktu",
          "Object"
        ]
      }
    },
    {
      "id": "q5",
      "prompt": "Choose the correct affirmative word order.",
      "choices": [
        "Nisa books reads.",
        "Reads Nisa books.",
        "Nisa reads books.",
        "Books reads Nisa."
      ],
      "answer": 2,
      "explanation": "Pola utamanya subject + verb + object.",
      "translationId": {
        "prompt": "Pilih susunan kalimat afirmatif yang paling tepat."
      }
    },
    {
      "id": "q6",
      "prompt": "What is the verb in “The cat sleeps”?",
      "choices": [
        "sleeps",
        "cat",
        "The",
        "The cat"
      ],
      "answer": 0,
      "explanation": "Sleeps menyatakan tindakan/keadaan yang dilakukan oleh cat.",
      "translationId": {
        "prompt": "Apa verb pada “The cat sleeps”?"
      }
    },
    {
      "id": "q7",
      "prompt": "What is the object in “We bought a notebook”?",
      "choices": [
        "There is no object",
        "We",
        "bought",
        "a notebook"
      ],
      "answer": 3,
      "explanation": "A notebook adalah benda yang dibeli.",
      "translationId": {
        "prompt": "Manakah object dalam “We bought a notebook”?",
        "choices": [
          "Tidak ada object",
          "We",
          "bought",
          "a notebook"
        ]
      }
    },
    {
      "id": "q8",
      "prompt": "Choose a correctly formed subject–verb sentence.",
      "choices": [
        "Birds fly.",
        "Birds are fly.",
        "Birds flying.",
        "Fly birds."
      ],
      "answer": 0,
      "explanation": "Birds berfungsi sebagai subject dan fly sebagai verb utama.",
      "translationId": {
        "prompt": "Pilih kalimat dengan pola S–V yang benar."
      }
    }
  ],
  "passages": []
}
