{
  "id": "quiz-basic-questions-negatives",
  "questionCount": 8,
  "durationSeconds": 600,
  "questions": [
    {
      "id": "q1",
      "prompt": "Choose the correct simple-present question.",
      "choices": [
        "Does he like coffee?",
        "Is he like coffee?",
        "Does he likes coffee?",
        "Do he like coffee?"
      ],
      "answer": 0,
      "explanation": "Does dipakai untuk he, dan sesudahnya gunakan verb dasar like.",
      "translationId": {
        "prompt": "Pilih pertanyaan simple present yang benar."
      }
    },
    {
      "id": "q2",
      "prompt": "Which is the correct negative form of “They play”?",
      "choices": [
        "They does not play.",
        "They do not play.",
        "They do not plays.",
        "They not play."
      ],
      "answer": 1,
      "explanation": "They menggunakan do not + verb dasar play.",
      "translationId": {
        "prompt": "Kalimat negatif “They play” yang tepat adalah …"
      }
    },
    {
      "id": "q3",
      "prompt": "Choose the correct past-tense question.",
      "choices": [
        "Was she watch TV?",
        "Did she watched TV?",
        "Does she watched TV?",
        "Did she watch TV?"
      ],
      "answer": 3,
      "explanation": "Did menandakan waktu lampau, kemudian gunakan verb dasar watch.",
      "translationId": {
        "prompt": "Pilih pertanyaan lampau yang benar."
      }
    },
    {
      "id": "q4",
      "prompt": "___ your friends ready now?",
      "choices": [
        "Does",
        "Are",
        "Is",
        "Did"
      ],
      "answer": 1,
      "explanation": "Your friends jamak dan predikatnya berupa adjective ready, sehingga gunakan Are.",
      "translationId": {
        "prompt": "___ teman-temanmu sudah siap sekarang?"
      }
    },
    {
      "id": "q5",
      "prompt": "Which is the correct negative form of “He is tired”?",
      "choices": [
        "He does not tired.",
        "He not is tired.",
        "He is not tired.",
        "He do not tired."
      ],
      "answer": 2,
      "explanation": "Negatif dengan be dibentuk dengan menambahkan not setelah is.",
      "translationId": {
        "prompt": "Kalimat negatif yang benar untuk “He is tired” adalah …"
      }
    },
    {
      "id": "q6",
      "prompt": "___ do you live? — In Bandung.",
      "choices": [
        "Why",
        "When",
        "Who",
        "Where"
      ],
      "answer": 3,
      "explanation": "Where dipakai untuk menanyakan tempat.",
      "translationId": {
        "prompt": "___ kamu tinggal? — Di Bandung."
      }
    },
    {
      "id": "q7",
      "prompt": "Choose the correct question.",
      "choices": [
        "Where does she study?",
        "Where do she study?",
        "Where does she studies?",
        "Where she studies?"
      ],
      "answer": 0,
      "explanation": "Urutannya Where + does + she + study.",
      "translationId": {
        "prompt": "Pilih pertanyaan yang tepat."
      }
    },
    {
      "id": "q8",
      "prompt": "Which negative simple-past sentence is correct?",
      "choices": [
        "He not did go.",
        "He did not went.",
        "He did not go.",
        "He does not went."
      ],
      "answer": 2,
      "explanation": "Did not diikuti verb dasar go.",
      "translationId": {
        "prompt": "Manakah kalimat negatif simple past yang benar?"
      }
    }
  ],
  "passages": []
}
