{
  "id": "school-reading-check",
  "questionCount": 4,
  "durationSeconds": 240,
  "passages": [
    {
      "id": "garden",
      "title": "Our school garden",
      "text": "Our school garden is a quiet space behind the science room. A narrow path runs between pots of herbs. Two wooden benches stand beside a mango tree. During breaks, students sit there to read or talk softly. The garden is small, but its shade makes it a comfortable place to rest."
    },
    {
      "id": "library",
      "title": "A morning at the community library",
      "text": "Last Saturday, our class visited a community library near the river. First, a volunteer showed us how donated books were sorted. Then we repaired torn covers and placed labels on the shelves. Before we left, each group recommended one book for younger readers. I had expected a quiet morning, but I discovered how much teamwork a small library needs."
    }
  ],
  "questions": [
    {
      "id": "sr1",
      "prompt": "According to the garden passage, where are the two wooden benches?",
      "choices": [
        "Beside a mango tree",
        "Inside the science room",
        "Outside the school gate"
      ],
      "answer": 0,
      "explanation": "Teks menyatakan dua bangku kayu ada beside a mango tree.",
      "passageId": "garden",
      "evidence": "Two wooden benches stand beside a mango tree.",
      "translationId": {
        "prompt": "Menurut teks taman, di mana letak dua bangku kayu?",
        "choices": [
          "Di samping pohon mangga",
          "Di dalam ruang sains",
          "Di luar gerbang sekolah"
        ]
      }
    },
    {
      "id": "sr2",
      "prompt": "What is the main purpose of the paragraph about the school garden?",
      "choices": [
        "To argue against planting trees",
        "To describe a particular school garden",
        "To tell the history of all school gardens"
      ],
      "answer": 1,
      "explanation": "Paragraf mengenalkan sebuah tempat lalu menjelaskan ciri fisik dan kegunaannya, sesuai tujuan teks deskriptif.",
      "passageId": "garden",
      "evidence": "Our school garden is a quiet space behind the science room.",
      "translationId": {
        "prompt": "Apa tujuan utama paragraf tentang taman sekolah?",
        "choices": [
          "Menentang penanaman pohon",
          "Menggambarkan taman sekolah tertentu",
          "Menceritakan sejarah semua taman sekolah"
        ]
      }
    },
    {
      "id": "sr3",
      "prompt": "Which event happened after the book covers were repaired?",
      "choices": [
        "The class arrived last Saturday.",
        "The volunteer explained sorting.",
        "Groups recommended books for younger readers."
      ],
      "answer": 2,
      "explanation": "Then menyatakan perbaikan sampul, sedangkan Before we left menandai kegiatan rekomendasi buku berikutnya.",
      "passageId": "library",
      "evidence": "Then we repaired torn covers and placed labels on the shelves. Before we left, each group recommended one book for younger readers.",
      "translationId": {
        "prompt": "Kegiatan mana yang terjadi setelah memperbaiki sampul buku dalam recount?",
        "choices": [
          "Kelas itu datang Sabtu lalu.",
          "Relawan menjelaskan cara penyortiran.",
          "Kelompok-kelompok merekomendasikan buku kepada pembaca lebih muda."
        ]
      }
    },
    {
      "id": "sr4",
      "prompt": "Which sentence expresses a reflection rather than a physical action?",
      "choices": [
        "Our class visited a community library.",
        "We repaired torn covers.",
        "I discovered how much teamwork a small library needs."
      ],
      "answer": 2,
      "explanation": "Discovered menunjukkan perubahan pemahaman narator, bukan tindakan fisik yang dilakukan di perpustakaan.",
      "passageId": "library",
      "evidence": "I had expected a quiet morning, but I discovered how much teamwork a small library needs.",
      "translationId": {
        "prompt": "Kalimat manakah yang menyatakan refleksi, bukan tindakan fisik?",
        "choices": [
          "Kelas kami mengunjungi perpustakaan komunitas.",
          "Kami memperbaiki sampul yang robek.",
          "Aku menyadari pentingnya kerja sama bagi perpustakaan kecil."
        ]
      }
    }
  ]
}
